{
  "$meta": {
    "version": "1.0.0",
    "project": "shopflow",
    "generatedAt": "2026-01-14T00:44:26.056Z",
    "horizonVersion": "0.1.0",
    "sources": {
      "purposeFiles": 5,
      "gateFiles": 1,
      "dreamFiles": 0
    }
  },
  "components": {
    "0": {
      "id": "0",
      "name": "0",
      "symbol": "#0",
      "category": "components",
      "path": "/Users/ascend/Documents/GitHub/a-paradigm/examples/shopflow/auth/.purpose",
      "description": "React context provider for auth state",
      "visualTags": [],
      "related": []
    },
    "1": {
      "id": "1",
      "name": "1",
      "symbol": "#1",
      "category": "components",
      "path": "/Users/ascend/Documents/GitHub/a-paradigm/examples/shopflow/auth/.purpose",
      "description": "Email/password login form with validation",
      "visualTags": [],
      "related": []
    },
    "2": {
      "id": "2",
      "name": "2",
      "symbol": "#2",
      "category": "components",
      "path": "/Users/ascend/Documents/GitHub/a-paradigm/examples/shopflow/auth/.purpose",
      "description": "New user registration form",
      "visualTags": [],
      "related": []
    },
    "3": {
      "id": "3",
      "name": "3",
      "symbol": "#3",
      "category": "components",
      "path": "/Users/ascend/Documents/GitHub/a-paradigm/examples/shopflow/components/.purpose",
      "description": "Accessible modal dialog",
      "visualTags": [],
      "related": []
    },
    "4": {
      "id": "4",
      "name": "4",
      "symbol": "#4",
      "category": "components",
      "path": "/Users/ascend/Documents/GitHub/a-paradigm/examples/shopflow/components/.purpose",
      "description": "Notification toast messages",
      "visualTags": [],
      "related": []
    },
    "5": {
      "id": "5",
      "name": "5",
      "symbol": "#5",
      "category": "components",
      "path": "/Users/ascend/Documents/GitHub/a-paradigm/examples/shopflow/components/.purpose",
      "description": "Loading placeholder skeleton",
      "visualTags": [],
      "related": []
    },
    "6": {
      "id": "6",
      "name": "6",
      "symbol": "#6",
      "category": "components",
      "path": "/Users/ascend/Documents/GitHub/a-paradigm/examples/shopflow/components/.purpose",
      "description": "Status and count badges",
      "visualTags": [],
      "related": []
    }
  },
  "features": {
    "0": {
      "id": "0",
      "name": "0",
      "symbol": "@0",
      "category": "features",
      "path": "/Users/ascend/Documents/GitHub/a-paradigm/examples/shopflow/auth/.purpose",
      "description": "Email/password and OAuth authentication",
      "visualTags": [],
      "related": []
    },
    "1": {
      "id": "1",
      "name": "1",
      "symbol": "@1",
      "category": "features",
      "path": "/Users/ascend/Documents/GitHub/a-paradigm/examples/shopflow/auth/.purpose",
      "description": "New account creation with email verification",
      "visualTags": [],
      "related": []
    },
    "2": {
      "id": "2",
      "name": "2",
      "symbol": "@2",
      "category": "features",
      "path": "/Users/ascend/Documents/GitHub/a-paradigm/examples/shopflow/auth/.purpose",
      "description": "Secure password recovery flow",
      "visualTags": [],
      "related": []
    },
    "3": {
      "id": "3",
      "name": "3",
      "symbol": "@3",
      "category": "features",
      "path": "/Users/ascend/Documents/GitHub/a-paradigm/examples/shopflow/.purpose",
      "description": "Save products for later",
      "visualTags": [],
      "related": []
    }
  },
  "flows": {
    "Checkout Flow": {
      "id": "Checkout Flow",
      "name": "Checkout Flow",
      "symbol": "$Checkout Flow",
      "path": "/Users/ascend/Documents/GitHub/a-paradigm/examples/shopflow/payments/.purpose",
      "description": "Complete purchase journey",
      "steps": [
        {
          "id": "Checkout Flow-step-0",
          "name": "Step 1",
          "order": 0
        },
        {
          "id": "Checkout Flow-step-1",
          "name": "Step 2",
          "order": 1
        },
        {
          "id": "Checkout Flow-step-2",
          "name": "Step 3",
          "order": 2
        },
        {
          "id": "Checkout Flow-step-3",
          "name": "Step 4",
          "order": 3
        },
        {
          "id": "Checkout Flow-step-4",
          "name": "Step 5",
          "order": 4
        },
        {
          "id": "Checkout Flow-step-5",
          "name": "Step 6",
          "order": 5
        }
      ]
    }
  },
  "state": {},
  "gates": {
    "0": {
      "id": "0",
      "name": "0",
      "symbol": "^0",
      "category": "gates",
      "path": "/Users/ascend/Documents/GitHub/a-paradigm/examples/shopflow",
      "description": "User must be logged in to access",
      "related": []
    },
    "1": {
      "id": "1",
      "name": "1",
      "symbol": "^1",
      "category": "gates",
      "path": "/Users/ascend/Documents/GitHub/a-paradigm/examples/shopflow",
      "description": "Enhanced checkout for premium subscribers",
      "related": []
    },
    "2": {
      "id": "2",
      "name": "2",
      "symbol": "^2",
      "category": "gates",
      "path": "/Users/ascend/Documents/GitHub/a-paradigm/examples/shopflow",
      "description": "Full administrative access to store management",
      "related": []
    },
    "3": {
      "id": "3",
      "name": "3",
      "symbol": "^3",
      "category": "gates",
      "path": "/Users/ascend/Documents/GitHub/a-paradigm/examples/shopflow",
      "description": "Access for store owners/merchants",
      "related": []
    },
    "4": {
      "id": "4",
      "name": "4",
      "symbol": "^4",
      "category": "gates",
      "path": "/Users/ascend/Documents/GitHub/a-paradigm/examples/shopflow",
      "description": "Prevents rapid checkout attempts (fraud protection)",
      "related": []
    }
  },
  "signals": {
    "undefined": {
      "id": "undefined",
      "name": "Undefined",
      "symbol": "!undefined",
      "category": "signals",
      "path": "/Users/ascend/Documents/GitHub/a-paradigm/examples/shopflow",
      "description": "Signal from gate 4",
      "related": []
    }
  },
  "screens": {},
  "symbolMap": {
    "@0": {
      "category": "features",
      "id": "0"
    },
    "@1": {
      "category": "features",
      "id": "1"
    },
    "@2": {
      "category": "features",
      "id": "2"
    },
    "@3": {
      "category": "features",
      "id": "3"
    },
    "#0": {
      "category": "components",
      "id": "0"
    },
    "#1": {
      "category": "components",
      "id": "1"
    },
    "#2": {
      "category": "components",
      "id": "2"
    },
    "#3": {
      "category": "components",
      "id": "3"
    },
    "#4": {
      "category": "components",
      "id": "4"
    },
    "#5": {
      "category": "components",
      "id": "5"
    },
    "#6": {
      "category": "components",
      "id": "6"
    },
    "$Checkout Flow": {
      "category": "flows",
      "id": "Checkout Flow"
    },
    "^0": {
      "category": "gates",
      "id": "0"
    },
    "!undefined": {
      "category": "signals",
      "id": "undefined"
    },
    "^1": {
      "category": "gates",
      "id": "1"
    },
    "^2": {
      "category": "gates",
      "id": "2"
    },
    "^3": {
      "category": "gates",
      "id": "3"
    },
    "^4": {
      "category": "gates",
      "id": "4"
    }
  }
}